,mixed_corpus
0,"विश्व तमिल सम्मेलन (तमिल: உலகத் தமிழ் மாநாடு) समय समय पर होने वाले राजनयिक सम्मेलनों की एक शृंखला है, जिसमें Tamil language, तथा विश्व भर के तमिल जनों की सामाजिक संवृद्धि पर विचारविमर्श किया जाता है प्रत्येक सम्मेलन में संसार भर के हजारों तमिल राजनयिक भाग लेते हैं यह सम्मेलन India के विभिन्न शहरों, तथा विश्व के पर्याप्त तमिल जनसंख्या वाले शहरों में आयोजित किया जाता हैसम्पन्न हुए सम्मेलनों की सूचीअब तक हुए विश्व तमिल सम्मेलनों की सूची निम्नवत् है:. References "
1,"एम एस स्वामिनाथन (जन्म: 7 अगस्त 1925, कुम्भकोणम, तमिलनाडु) पौधों के जेनेटिक वैज्ञानिक हैं जिन्हें India की Green Revolution का जनक माना जाता है उन्होंने 1966 में मैक्सिको के बीजों को पंजाब की घरेलू किस्मों के साथ मिश्रित करके उच्च उत्पादकता वाले गेहूं के संकर बीज विकिसित किए उन्हें विज्ञान एवं अभियांत्रिकी के क्षेत्र में India सरकार द्वारा सन 1972 में Padma Bhushan से सम्मानित किया गया'Green Revolution' कार्यक्रम के तहत ज़्यादा उपज देने वाले गेहूं और चावल के बीज ग़रीब किसानों के खेतों में लगाए गए थे इस क्रांति ने India को दुनिया में खाद्यान्न की सर्वाधिक कमी वाले देश के कलंक से उबारकर 25 वर्ष से कम समय में आत्मनिर्भर बना दिया था उस समय से India के कृषि पुनर्जागरण ने स्वामीनाथन को 'कृषि क्रांति आंदोलन' के वैज्ञानिक नेता के रूप में ख्याति दिलाई उनके द्वारा सदाबाहर क्रांति की ओर उन्मुख अवलंबनीय कृषि की वकालत ने उन्हें अवलंबनीय खाद्य सुरक्षा के क्षेत्र में विश्व नेता का दर्जा दिलाया एम. एस. स्वामीनाथन को 'विज्ञान एवं अभियांत्रिकी' के क्षेत्र में 'India सरकार' द्वारा सन 1967 में 'पद्म श्री', 1972 में 'Padma Bhushan' और 1989 में 'पद्म विभूषण' से सम्मानित किया गया थाGreen Revolution के अगुआIndia लाखों गाँवों का देश है और यहाँ की अधिकांश जनता कृषि के साथ जुड़ी हुई है इसके बावजूद अनेक वर्षों तक यहाँ कृषि से सम्बंधित जनता भी भुखमरी के कगार पर अपना जीवन बिताती रही इसका कारण कुछ भी हो, पर यह भी सत्य है कि ब्रिटिश शासनकाल में भी खेती अथवा मजदूरी से जुड़े हुए अनेक लोगों को बड़ी कठिनाई से खाना प्राप्त होता था कई अकाल भी पड़ चुके थे India के सम्बंध में यह भावना बन चुकी थी कि कृषि से जुड़े होने के बावजूद India के लिए भुखमरी से निजात पाना कठिन है इसका कारण यही था कि India में कृषि के सदियों से चले आ रहे उपकरण और बीजों का प्रयोग होता रहा था फसलों की उन्नति के लिए बीजों में सुधार की ओर किसी का ध्यान ही नहीं गया थाएम. एस. स्वामीनाथन ही वे पहले व्यक्ति थे, जिन्होंने सबसे पहले Wheat की एक बेहतरीन किस्म को पहचाना और स्वीकार किया इस कार्य के द्वारा India को अन्न के मामले में आत्मनिर्भर बनाया जा सकता था यह मैक्सिकन Wheat की एक किस्म थी, जिसे स्वामीनाथन ने Indiaीय खाद्यान्न की कमी दूर करने के लिए सबसे पहले अपनाने के लिए स्वीकार किया इसके कारण India के Wheat उत्पादन में भारी वृद्धि हुई इसलिए स्वामीनाथन को ""India में Green Revolution का अगुआ"" माना जाता है स्वामीनाथन के प्रयत्नों का परिणाम यह है कि India की आबादी में प्रतिवर्ष पूरा एक ऑस्ट्रेलिया समा जाने के बाद भी खाद्यान्नों के मामले में वह आत्मनिर्भर बन चुका है India के खाद्यान्नों का निर्यात भी किया है और निरंतर उसके उत्पादन में वृद्धि होती रही हैसम्मान और पुरस्कारलंदन की रॉयल सोसायटी सहित विश्व की 14 प्रमुख विज्ञान परिषदों ने एम. एस. स्वामीनाथन को अपना मानद सदस्य चुना है अनेक विश्वविद्यालयों ने डॉक्टरेट की उपाधियों से उन्हें सम्मानित किया है स्वामीनाथन द्वारा प्राप्त किए गए सम्मान व पुरस्कार इस प्रकार हैं[1]-1971 में सामुदायिक नेतृत्व के लिए 'मैग्सेसे पुरस्कार'1986 में 'अल्बर्ट आइंस्टीन वर्ल्ड साइंस पुरस्कार'1987 में पहला 'विश्व खाद्य पुरस्कार'1991 में अमेरिका में 'टाइलर पुरस्कार'1994 में पर्यावरण तकनीक के लिए जापान का 'होंडा पुरस्कार'1997 में फ़्राँस का 'ऑर्डर दु मेरिट एग्रीकोल' (कृषि में योग्यताक्रम)1998 में मिसूरी बॉटेनिकल गार्डन (अमरीका) का 'हेनरी शॉ पदक'1999 में 'वॉल्वो इंटरनेशनल एंवायरमेंट पुरस्कार'1999 में ही 'यूनेस्को गांधी स्वर्ग पदक' से सम्मानित'India सरकार ने एम. एस. स्वामीनाथन को 'पद्मश्री' (1967), 'पद्मभूषण' (1972) और 'पद्मविभूषण' (1989) से सम्मानित किया थाशोध केंद्र की स्थापनाविभिन्न पुरस्कारों और सम्मानों के साथ प्राप्त धनराशि से एम. एस. स्वामीनाथन ने वर्ष 1990 के दशक के आरंभिक वर्षों में 'अवलंबनीय कृषि तथा ग्रामीण विकास' के लिए चेन्नई में एक शोध केंद्र की स्थापना की 'एम. एस. स्वामीनाथन रिसर्च फाउंडेशन' का मुख्य उदेश्य Indiaीय गांवों में प्रकृति तथा महिलाओं के अनुकूल प्रौद्योगिकी के विकास और प्रसार पर आधारित रोजग़ार उपलब्ध कराने वाली आर्थिक विकास की रणनीति को बढ़ावा देना हैप्रभावशाली व्यक्तिफ़ाउंडेशन में स्वामीनाथन और उनके सहयोगियों द्वारा पर्यावरण प्रौद्यौगिकी के क्षेत्र में किए जा रहे कार्य को अंतर्राष्ट्रीय मान्यता मिली है स्वामीनाथन दक्षिण एशिया के उत्तरदायित्व के साथ पर्यावरण प्रौद्योगिकी के क्षेत्र में यूनेस्को में भी पदासीन रहे हैं उनकी महान विद्वत्ता को स्वीकरते हुए इंग्लैंड की रॉयल सोसाइटी और बांग्लादेश, चीन, इटली, स्वीडन, अमरीका तथा सोवियत संघ की राष्ट्रीय विज्ञान अकादमियों में उन्हें शामिल किया गया है वह 'वर्ल्ड एकेडमी ऑफ साइंसेज़' के संस्थापक सदस्यों में से एक हैं 1999 में टाइम पत्रिका ने स्वामीनाथन को 20वीं सदी के 20 सबसे प्रभावशाली एशियाई व्यक्तियों में से एक बताया थासन्दर्भएम०एस०स्वामीनाथन एक बहुत बड़े वनस्पतिक वैज्ञानिक थे जिन्हें Green Revolution का जनक  कहे जाने का एक मुख्य कारण है क्योंकि इन्होंने वनस्पति जीवन मे अपना बहुत बड़ा योगदान दिया जिससे इन्हें वनस्पतिक जगत का जनक,दाता भी कहा जाता हैइन्हें भी देखेंNational Commission on Farmersबाहरी कड़ियाँ‘Father of Indian Green Revolution’ MS Swaminathan-hails-Modi-government"
