,mixed_corpus
0,"भगवान महावीर Jainism के चौंबीसवें (२४वें) Tirthankara है भगवान महावीर का जन्म करीब ढाई हजार साल पहले (ईसा से 599 वर्ष पूर्व), Vaishali (ancient city) के गणतंत्र राज्य क्षत्रिय कुण्डलपुर में हुआ था तीस वर्ष की आयु में महावीर ने संसार से विरक्त होकर राज वैभव त्याग दिया और संन्यास धारण कर आत्मकल्याण के पथ पर निकल गये १२ वर्षो की कठिन Tapas (Indian religions)स्या के बाद उन्हें Kevala Jnana प्राप्त हुआ जिसके पश्चात् उन्होंने Samavasarana में ज्ञान प्रसारित किया ७२ वर्ष की आयु में उन्हें Pawapuri से मोक्ष की प्राप्ति हुई इस दौरान महावीर स्वामी के कई अनुयायी बने जिसमें उस समय के प्रमुख राजा Bimbisara, Ajatashatru और Chetaka भी शामिल थे जैन समाज द्वारा महावीर स्वामी के जन्मदिवस को Mahavir Janma Kalyanak तथा उनके मोक्ष दिवस को Diwali के रूप में धूम धाम से मनाया जाता हैजैन ग्रन्थों के अनुसार समय समय पर Dharma तीर्थ के प्रवर्तन के लिए Tirthankaraों का जन्म होता है, जो सभी जीवों को आत्मिक सुख प्राप्ति का उपाय बताते है Tirthankaraों की संख्या चौबीस ही कही गयी है भगवान महावीर वर्तमान Avasarpiṇī काल की चौबीसी के अंतिम Tirthankara थे और Rishabhanatha पहले हिंसा, पशुबलि, जात-पात का भेद-भाव जिस युग में बढ़ गया, उसी युग में भगवान महावीर का जन्म हुआ उन्होंने दुनिया को Satya, Ahiṃsā का पाठ पढ़ाया Tirthankara महावीर स्वामी ने Ahiṃsā को सबसे उच्चतम नैतिक गुण बताया उन्होंने दुनिया को Jainism के पंचशील सिद्धांत बताए, जो है– Ahiṃsā, Satya, Aparigraha, अचौर्य (Asteya) और Brahmacarya उन्होंने Anekantavada, Syādvāda और Aparigraha जैसे अद्भुत सिद्धांत दिए महावीर के सर्वोदयी तीर्थों में क्षेत्र, काल, समय या जाति की सीमाएँ नहीं थीं भगवान महावीर का आत्म Dharma जगत की प्रत्येक आत्मा के लिए समान था दुनिया की सभी आत्मा एक-सी हैं इसलिए हम दूसरों के प्रति वही विचार एवं व्यवहार रखें जो हमें स्वयं को पसंद हो यही महावीर का 'जीयो और जीने दो' का सिद्धांत हैजीवनजन्मभगवन महावीर का जन्म ईसा से 599 वर्ष पहले Vaishali (ancient city) गणतंत्र के कुण्डलपुर में Solar dynasty के क्षत्रिय Siddhartha of Kundagrama और रानी Trishala के यहाँ चैत्र शुक्ल तेरस को हुआ था ग्रंथों के अनुसार उनके जन्म के बाद राज्य में उन्नति होने से उनका नाम वर्धमान रखा गया था Jain literature Uttarapurana में वर्धमान, वीर, अतिवीर, महावीर और सन्मति ऐसे पांच नामों का उल्लेख है इन सब नामों के साथ कोई कथा जुडी हैJain literatureों के अनुसार, २३वें Tirthankara Parshvanatha जी के निर्वाण (मोक्ष) प्राप्त करने के 188 वर्ष बाद इनका जन्म हुआ थाविवाहDigambara परम्परा के अनुसार महावीर बाल ब्रह्मचारी थे भगवान महावीर शादी नहीं करना चाहते थे क्योंकि Brahmacarya उनका प्रिय विषय था भोगों में उनकी रूचि नहीं थी परन्तु इनके माता-पिता शादी करवाना चाहते थे Digambara परम्परा के अनुसार उन्होंने इसके लिए मना कर दिया था Śvētāmbara परम्परा के अनुसार इनका विवाह यशोदा नामक सुकन्या के साथ सम्पन्न हुआ था और कालांतर में प्रियदर्शिनी नाम की कन्या उत्पन्न हुई जिसका युवा होने पर राजकुमार जमाली के साथ विवाह हुआTapas (Indian religions)स्याभगवान महावीर का साधना काल १२ वर्ष का था दीक्षा लेने के उपरान्त भगवान महावीर ने Digambara साधु की कठिन चर्या को अंगीकार किया और निर्वस्त्र रहे Śvētāmbara सम्प्रदाय जिसमें साधु श्वेत वस्त्र धारण करते है के अनुसार भी महावीर दीक्षा उपरान्त कुछ समय छोड़कर निर्वस्त्र रहे और उन्होंने Kevala Jnana की प्राप्ति भी Digambara अवस्था में ही की अपने पूरे साधना काल के दौरान महावीर ने कठिन Tapas (Indian religions)स्या की और मौन रहे इन वर्षों में उन पर कई ऊपसर्ग भी हुए जिनका उल्लेख कई प्राचीन Jain literatureों में मिलता हैKevala Jnana और उपदेशइन्हें भी देखें: Jainism में भगवानजैन ग्रन्थों के अनुसार Kevala Jnana प्राप्ति के बाद, भगवान महावीर ने उपदेश दिया उनके ११ Ganadhara (मुख्य शिष्य) थे जिनमें प्रथम इंद्रभूति थेजैन ग्रन्थ, Uttarapurana के अनुसार महावीर स्वामी ने समवसरण में जीव आदि सात तत्त्व, छह द्रव्य, संसार और मोक्ष के कारण तथा उनके फल का नय आदि उपायों से वर्णन किया थापाँच व्रतSatya ― Satya के बारे में भगवान महावीर स्वामी कहते हैं, हे पुरुष! तू Satya को ही सच्चा तत्व समझ जो बुद्धिमान Satya की ही आज्ञा में रहता है, वह मृत्यु को तैरकर पार कर जाता हैAhiṃsā – इस लोक में जितने भी त्रस जीव (एक, दो, तीन, चार और पाँच इंद्रीयों वाले जीव) है उनकी हिंसा मत कर, उनको उनके पथ पर जाने से न रोको उनके प्रति अपने मन में दया का भाव रखो उनकी रक्षा करो यही Ahiṃsā का संदेश भगवान महावीर अपने उपदेशों से हमें देते हैंअचौर्य - दुसरे के वस्तु बिना उसके दिए हुआ ग्रहण करना Jain literatureों में चोरी कहा गया हैAparigraha – परिग्रह पर भगवान महावीर कहते हैं जो आदमी खुद सजीव या निर्जीव चीजों का संग्रह करता है, दूसरों से ऐसा संग्रह कराता है या दूसरों को ऐसा संग्रह करने की सम्मति देता है, उसको दुःखों से कभी छुटकारा नहीं मिल सकता यही संदेश Aparigraha का माध्यम से भगवान महावीर दुनिया को देना चाहते हैंBrahmacarya- महावीर स्वामी Brahmacarya के बारे में अपने बहुत ही अमूल्य उपदेश देते हैं कि Brahmacarya उत्तम Tapas (Indian religions)स्या, नियम, ज्ञान, दर्शन, चारित्र, संयम और विनय की जड़ है Tapas (Indian religions)स्या में Brahmacarya श्रेष्ठ Tapas (Indian religions)स्या है जो पुरुष स्त्रियों से संबंध नहीं रखते, वे मोक्ष मार्ग की ओर बढ़ते हैंJain monasticism, Aryika इन्हें पूर्ण रूप से पालन करते है, इसलिए उनके Ethics of Jainism होते है और Śrāvaka, श्राविका इनका एक देश पालन करते है, इसलिए उनके अणुव्रत कहे जाते हैदस DharmaJain literatureों में दस Dharma का वर्णन है Paryushana पर्व, जिन्हें दस लक्षण भी कहते है के दौरान दस दिन इन दस Dharmaों का चिंतन किया जाता हैForgivenessForgiveness के बारे में भगवान महावीर कहते हैं- 'मैं सब जीवों से Forgiveness चाहता हूँ जगत के सभी जीवों के प्रति मेरा मैत्रीभाव है मेरा किसी से वैर नहीं है मैं सच्चे हृदय से Dharma में स्थिर हुआ हूँ सब जीवों से मैं सारे अपराधों की Forgiveness माँगता हूँ सब जीवों ने मेरे प्रति जो अपराध किए हैं, उन्हें मैं Forgiveness करता हूँ'वे यह भी कहते हैं 'मैंने अपने मन में जिन-जिन पाप की वृत्तियों का संकल्प किया हो, वचन से जो-जो पाप वृत्तियाँ प्रकट की हों और शरीर से जो-जो पापवृत्तियाँ की हों, मेरी वे सभी पापवृत्तियाँ विफल हों मेरे वे सारे पाप मिथ्या हों'DharmaDharma सबसे उत्तम मंगल है Ahiṃsā, संयम और Tapas (Indian religions) ही Dharma है महावीरजी कहते हैं जो Dharmaात्मा है, जिसके मन में सदा Dharma रहता है, उसे देवता भी नमस्कार करते हैंभगवान महावीर ने अपने प्रवचनों में Dharma, Satya, Ahiṃsā, Brahmacarya और Aparigraha, Forgiveness पर सबसे अधिक जोर दिया त्याग और संयम, प्रेम और करुणा, शील और सदाचार ही उनके प्रवचनों का सार थामोक्षTirthankara महावीर का केवलिकाल ३० वर्ष का था उनके के संघ में १४००० मुनि, ३६००० Aryikaएँ, १००००० Śrāvaka और ३००००० श्रविकाएँ थी भगवान महावीर ने ईसापूर्व 527, 72 वर्ष की आयु में Bihar के Pawapuri (राजगीर) में कार्तिक कृष्ण अमावस्या को निर्वाण (मोक्ष) प्राप्त किया उनके साथ अन्य कोई मुनि मोक्ष नहीं गए | Pawapuri में एक जल मंदिर स्थित है जिसके बारे में कहा जाता है कि यही वह स्थान है जहाँ से महावीर स्वामी को मोक्ष की प्राप्ति हुई थीवर्तमान मेंदूसरी सदी के प्रभावशाली Digambara मुनि, Samantabhadra (Jain monk) ने Tirthankara महावीर के तीर्थ को सर्वोदय की संज्ञा दी थीवर्तमान अशांत, आतंकी, भ्रष्ट और हिंसक वातावरण में महावीर की Ahiṃsā ही शांति प्रदान कर सकती है महावीर की Ahiṃsā केवल सीधे वध को ही हिंसा नहीं मानती है, अपितु मन में किसी के प्रति बुरा विचार भी हिंसा है वर्तमान युग में प्रचलित नारा 'समाजवाद' तब तक सार्थक नहीं होगा जब तक आर्थिक विषमता रहेगी एक ओर अथाह पैसा, दूसरी ओर अभाव इस असमानता की खाई को केवल भगवान महावीर का 'Aparigraha' का सिद्धांत ही भर सकता है Aparigraha का सिद्धांत कम साधनों में अधिक संतुष्टिपर बल देता है यह आवश्यकता से ज्यादा रखने की सहमति नहीं देता है इसलिए सबको मिलेगा और भरपूर मिलेगाजब अचौर्य की भावना का प्रचार-प्रसार और पालन होगा तो चोरी, लूटमार का भय ही नहीं होगा सारे जगत में मानसिक और आर्थिक शांति स्थापित होगी चरित्र और संस्कार के अभाव में सरल, सादगीपूर्ण एवं गरिमामय जीवन जीना दूभर होगा भगवान महावीर ने हमें अमृत कलश ही नहीं, उसके रसपान का मार्ग भी बताया हैइतने वर्षों के बाद भी भगवान महावीर का नाम स्मरण उसी श्रद्धा और भक्ति से लिया जाता है, इसका मूल कारण यह है कि महावीर ने इस जगत को न केवल मुक्ति का संदेश दिया, अपितु मुक्ति की सरल और सच्ची राह भी बताई भगवान महावीर ने आत्मिक और शाश्वत सुख की प्राप्ति हेतु Ahiṃsā Dharma का उपदेश दियासाहित्यकाव्यात्मकSamantabhadra (Jain monk) विरचित स्वयंभूस्तोत्र चौबीस Tirthankara भगवानों की स्तुति है इसके आठ श्लोक भगवान महावीर को समर्पित है Samantabhadra (Jain monk) विरचित 'युक्तानुशासन' एक काव्य रचना है जिसके ६४ श्लोकों में Tirthankara महावीर की स्तुति की गयी हैमहाकवि पदम कृत महावीर रास - इसका रचना काल वि•स• की 18वीं सदी का मध्यकाल है इसका प्रथम बार हिंदी अनुवाद और संपादन डॉ. विद्यावती जैन जी द्वारा किया गया था यह 1994 में प्राच्य श्रमण भारती द्वारा प्रकाशित किया गया थापुरातत्वभगवान महावीर की कई प्राचीन प्रतिमाओं के देश और विदेश के संग्रहालयों में दर्शन होते है महाराष्ट्र के एल्लोरा गुफाओं में भगवान महावीर की प्रतिमा मौजूद है कर्नाटक की बादामी गुफाओं में भी भगवान महावीर की प्रतिमा स्थित हैइन्हें भी देखेंकेवलीJai JinendraJainism में भगवाननोटसन्दर्भग्रन्थप्रमाणसागर (2008), जैन तत्त्वविद्या, Bharatiya Jnanpith, International Standard Book Number 978-81-263-1480-5, Wikidata Q41794338प्रमाणसागर, मुनि (२००८), जैन तत्त्वविद्या, Bharatiya Jnanpith, International Standard Book Number 978-81-263-1480-5गुणभद्र, आचार्य; जैन, साहित्याचार्य डॉ पन्नालाल (2015), Uttarapurana, Bharatiya Jnanpith, International Standard Book Number 978-81-263-1738-7जैन, विजय.क. (२०१५), समन्तभद्र स्वामी विरचित स्वयम्भूस्तोत्र, Vikalp Printers, International Standard Book Number 9788190363976, Non-CopyrightJain, Hiralal; Upadhye, Adinath Neminath (2000) [1974], Mahavira, his times and his philosophy of life, Bharatiya JnanpithJain, Hiralal (1 January 2002), Jaina Tradition in Indian Thought, International Standard Book Number 9788185616841Jain, Dr. Gokulchandra (2015), Samantabhadrabhāratī (1st संस्करण), बुढ़ाना, मुज़फ्फरनगर: आचार्य शांति सागर छाणी स्मृति ग्रंथमाला Smriti, International Standard Book Number 978-81-90468879बाहरी कड़ियाँभगवान महावीर का जीवन सन्देश, लेखक – डॉ दरबारीलाल कोठिया"
