,mixed_corpus
0,"Hindu saints गोरा कुम्भार (Sant Gora Kumbhar) (गोरोबा के रूप में भी जाना जाता है) Bhakti आंदोलन और Maharashtra के वारकरी संप्रदाय से जुड़े एक हिंदू Hindu saints थेगोरा कुम्भार और अन्य Hindu saintsों ने अभंग (शब्दों को नष्ट नहीं किया जा सकता है) के सैकड़ों गीतों को भी लिखा और गाया वारकरी संप्रदाय का मुख्य सिद्धांत कीर्तन का दैनिक जप थाजीवनगोरा कुम्भार को पारंपरिक रूप से सत्यपुरी गांव में रहने वाला माना जाता है, जिसे वर्तमान में Maharashtra राज्य के उस्मानाबाद जिले में गोरबा टेर के रूप में जाना जाता है माना जाता है कि वह नामदेव के समकालीन थे वह 1267 और 1317 के बीच जिये उसके नाम पर एक छोटा सा मंदिर गांव में बनाया गया था और जिसे उनके भक्तों पुजा करने आते हैलोकप्रिय संस्कृति मेंगोरा कुम्भार के जीवन और Bhakti के बारे में भारत में कई फिल्मे तैयार किए गए हैं:के एस गोपालकृष्णन ने 1948 में ""चक्राधरी"" नामक तेलुगू फिल्म का निर्देशन किया जिसमे चित्तौड़ वी नागाया और एस वरलक्ष्मी ने अभिनय कियाके एस गोपालकृष्णन ने 1948 में ""चक्राधरी"" नामक तमिल फिल्म का निर्देशन किया था इसमें चितोर वी नागाय्या और पुष्पवल्ली ने भूमिका निभाई थी1974 की कन्नड़ फिल्म ""भक्त कुम्भारा"" फिल्म जिसमे राजकुमार अभिनीत ने अभिनव कियावी मधुसूदन राव ने 1977 में ""चक्रवर्ती"" नामक एक और तेलगू फिल्म का निर्देशन किया इसमे नागेश्वर राव ने अभिनय कियामराठी फिल्म ""गोरा कुम्भार"", जिसमे ललिता पवार और अन्य लोगों ने अभिनय कियादिनेश रावल ने 1978 मे गुजराती फिल्म ""भगत गोरा"" कुम्भार का निर्देशन किया जिसमे अरविन्द त्रिवेदी, सरला एवलेकर, कल्पना दीवान, श्रीकांत सोनी, महेश जोशी और अन्य लोगों ने अभिनय कियाइन्हें भी देखेंHinduism सन्दर्भ "
1,"कन्होपत्रा एक 15 वीं सदी के मराठी संत-कवयत्रि थी हिंदू Dharma के वरकारि संप्रदाय द्वारा सम्मानित थी सबसे पारंपरिक के अनुसार, कान्होपत्रा एक वेश्या और नाचने लढकि थीवह वरकारी Dharma को मानती थी वह बीदर के बादशाह (राजा) की उपपत्नी से बिना वर्कारी के हिंदू भगवान विठोबा-देवता संरक्षक को आत्मसमर्पण करने के लिए चुनाएवह Pandharpur में विठोबा के मुख्य मंदिर में निधन हो गयासिर्फ उन्हो एक ही व्यक्ति किसके समाधि मंदिर के परिसर के भीतर है कन्होपत्रा मराठी ओवी और अभंगा अपने पेशे के साथ उसका शील संतुलन के लिए विठोबा के प्रति उसकी Bhakti और उसके संघर्ष की कविता कह लिखि थीउनकी कविताओं में, भगवान विठोबा उसके रक्षक बनते थे और अपने पेशे के चंगुल से उसे रिहा करने के लिए प्रार्थना कर रहि थीउसकी तीस अभंगा आज भी बच गया है और आज भी लोगा गाते हैवह सिर्फ एक ही Woman संत वरकारि,जिन्होंने पवित्रता केवल उनकी Bhakti के आधार गुरु बिना प्राप्त किये हैजीवनकन्होपत्रा के इतिहास सदियों से माध्यम से लोग जानते है कि उनके कहानियों नीचे पारित कर दिया गया है और उनके कहानियों मे तथ्य और कल्पना करने के लिए मुश्किल बना गयि है उसके जन्म के बारे में शमा कर के लोग मानते है और उसकि मौथ विठोबा मंदिर जब बीदर के बादशाह ने उसको चाह हालांकि, सदाShiva मालगुजर (आरोप लगा हुआ पिता) और हौसा नौकरानी के पात्रों उनकि चरित्राओं में नहीं दिखाई देते हैप्रारंभिक जीवनकन्होपत्रा एक अमीर वेश्या शमा कि बेठी थी, जो Pandharpur के मंगलवेद शेहर मे रहते थे कन्होपत्रा के अलावा मंगलवेद संतों वरकारि चोखामेला और डमाजि का भी शमा कन्होपत्रा के पिता की पहचान के बारे में अनिश्चित था, लेकिन यह संदेह था कि शहर के सिर मैन सदाShiva मालगुजर जन्मस्थान है कन्होपत्रा उसकी माँ के महलनुमा घर में उसके बचपन बिताया थी और कई नौकरानियों द्वारा सेवा कराते थे कन्होपत्रा की Social स्थिति बहुत ही कम थाकन्होपत्रा बचपन से ही नृत्य और गीत में प्रशिक्षित किया गया था ताकि वह अपनी माँ के पेशे में शामिल होने सकि वह एक प्रतिभाशाली नर्तकी और गायक बन गएउसकी सुंदरता अप्सरा (स्वर्गीय अप्सरा) मेनका से तुलना करते थेशमा ने कन्होपत्रा को सुझाए गया कि बादशाह (मुस्लिम राजा) को मिलना है, तब जो उसकी सुंदरता और उपहार उसे पैसे और गहने Puja (Hinduism) होगी लेकिन कन्होपत्र साफ ​​इनकार कर दिया कन्होपत्रा की मा शामा ने कन्होपत्रा को शादी करवाने के लिये सोचा था विद्वान तारा भवलकार कहा गया है कि कन्होपत्रा की शादी के लिए मना किया गया था क्यों कि वह एक दासि कि बेठी है कन्होपत्रा को वेश्या के जीवन मे आशा नहि थी लेकिन उसके लिये घ्रुणा किये थे और भी लोग कहते हेय कि वह वेश्या बनने के लिये मजबूति से मना कि थी कुछ लेखकों का मानना ​​है कि हो सकता है कि वह भी एक वेश्या के रूप में काम किया हैBhakti पथसदाShiva मालगुजर, कन्होपात्रा की अपेक्षा की पिता, कन्होपत्रा की सुंदरता के बारे में सुना है और उसके नृत्य को देखने के लिए कामना की, लेकिन कन्होपत्रा से इनकार कर दियातदनुसार, सदाShiva कन्होपत्रा और शमा को परेशान करना शुरू कर दिया थाशमा उसे समझा दिया है कि वह कन्होपत्रा का पिता था और इस तरह उन्हें छोड़ देना चाहिए की कोशिश की, लेकिन सदाShiva उसे विश्वास नहीं कियावह अपने उत्पीड़न जारी रखा, शमा के धन धीरे-धीरे समाप्त हो गयाआखिरकार, शमा सदाShiva के लिए माफी मांगी और उसे करने के लिए कन्होपत्रा पेश करने की पेशकश की कन्होपत्रा, तथापि, एक नौकरानी के रूप में प्रच्छन्न उसकी वृद्ध नौकरानी हौसा की मदद से Pandharpur के लिए भाग गए कुछ किंवदंतियों में, होउसा वर्णित के रूप में एक वरकारि Bhakti करने के लिए कन्होपत्रा की यात्रा के लिए श्रेय दियाअन्य खातों वरकारि तीर्थयात्रियों जो Pandharpur में विठोबा मंदिर के लिए अपने रास्ते पर कन्होपत्रा के घर से पारित क्रेडिट दिया एक कहानी के अनुसार, उदाहरण के लिए, वह विठोबा के बारे में एक गुजर वरकारि से पूछावरकारि कहा कि विठोबा "", उदार बुद्धिमान, सुंदर और सही"" है, उसकी महिमा का वर्णन से परे है और उसकी सुंदरता से बढ़कर लक्ष्मी, सौंदर्य की देवी का है कन्होपत्रा आगे पूछा कि क्या विठोबा एक भक्त के रूप में उसे स्वीकार करेंगे क्या और वरकारि कह कि वह कन्होपत्रा को स्वीकार करेंगेइस आश्वासन,Pandharpur जाने के लिए उसके संकल्प को मजबूत बनाया कन्होपत्रा तुरंत वरकारि तीर्थयात्रियों के साथ विठोबा-के भजन Pandharpur-गायन के लिए छोड़ देता है या Pandharpur उसके साथ उसकी माँ को भी समझाकर जाति थी जब कन्होपत्रा ने पहलि बार् Pandharpur की विठोबा छवि को देखा है,तब उन्होंने अभंगाओं को गाने के लिए शुरु कर दिया वह एक अभंगा में गायि थी कि उसे आध्यात्मिक योग्यता पूरी की थी और वह विठोबा के पैरों देखा है के लिए आशीर्वाद दिया था वह अद्वितीय सौंदर्य वह विठोबा में उसके दूल्हे की मांग में पाया था वह भगवान से ""विवाहित"" खुद को माना और Pandharpur में बस गएवह समाज से वापस ले लिया कन्होपत्रा हौसा के साथ Pandharpur में एक झोपड़ी में ले जाया गया और एक तपस्वी का जीवन जिया वह विठोबा मंदिर में गाया और नृत्य किया था, और यह एक दिन में दो बार साफ किया थी वह लोगों के संबंध में प्राप्त की,और लोग मानते थे कि वह एक किसान कि बेठी थीइस अवधि पर , कन्होपत्रा विठोबा के लिए समर्पित ओवी कविताओं की रचना कीमौतइस अवधि पर सदाShiva बादशाह से मदद माँगा कन्होपत्रा की सुंदरता के किस्से सुनकर बादशाह उसकी रखैल बनने के लिए उसे आदेश दियाजब उसने मना कर दिया, राजा बल द्वारा उसे पाने के लिए अपने आदमियों को भेजा था कन्होपत्रा विठोबा मंदिर में शरण ली राजा के सैनिकों मंदिर को घेर लिया और इसे नष्ट करने के लिए अगर कन्होपत्रा उन्हें सौंप दिया गया था नहीं की धमकी दी कन्होपत्रा ले जाया जा रहा से पहले विठोबा के साथ एक पिछली बैठक का अनुरोध किया सभी इसाब के द्वारा, कन्होपत्रा तो विठोबा छवि के पैर में निधन हो गया, लेकिन हालात स्पष्ट नहीं थे लोकप्रिय परंपरा के अनुसार, कन्होपत्रा शादी-कुछ कन्होपत्रा के लिए इंतज़ार के एक फार्म में विठोबा की छवि के साथ विलय कर दिया अन्य सिद्धांतों का सुझाव है कि वह खुद को मार डाला है, या कि वह उसकी निरंकुशता के लिए मार डाला गया था अधिकांश इसाब कहते है कि कन्होपत्रा के शरीर विठोबा के चरणों में रखी गई थी और उसके बाद मंदिर के दक्षिणी भाग के पास दफनाया गया थापौराणिक कथा के सभी संस्करणों के अनुसार, एक तरति पेड़-जो उसके तीर्थयात्रियों द्वारा Puja (Hinduism) की जाती है की मौके पर ही स्मरण-उठी जहां कन्होपत्रा दफनाया गया था कन्होपत्रा केवल एक ही व्यक्ति जिसका समाधि (समाधि) विठोबा मंदिर के परिसर में हैदिनांकनकई इतिहासकारों कन्होपत्रा के जीवन और Death की तिथि को स्थापित करने का प्रयास किया है एक अनुमान उसकी बीदर के बहमनी एक राजा, जो अक्सर कन्होपत्रा कहानी हालांकि ज्यादातर खातों में, कि राजा को स्पष्ट रूप से नामित कभी नहीं जाता है के साथ जुड़ा हुआ है के संबंध में से लगभग 1428 सीई उसके जीवन देता है पवार का अनुमान है कि वह 1480 में Death हो गई थी दूसरों को 1448, 1468 या 1470, या बस की तारीखों का कहना है कि वह 15 वीं सदी या दुर्लभ मामलों में, 13 वीं या 16 वीं सदी में रहते थे का सुझाव है जेल्लियट के अनुसार, वह संत-कवियों चोखामेला (14 वीं सदी) और नामदेवा (c.1270-c.1350) के समकालीन थेसाहित्यिक कृतियों और शिक्षाओंकन्होपत्रा कई अभंगा बना है माना जाता है, लेकिन सबसे लिखित रूप में नहीं थे: उसे का केवल तीस या ओविस आज जीवित रहते हैं सकल संत-गाथा कहा जाता तेईस उसकी कविताओं के छंद वरकारि संतों के संकलन में शामिल किए गए हैं इन गीतों में से अधिकांश आत्मकथात्मक हैं करुणा का एक तत्व के साथ लिखा गया है उसकी शैली, Poetry उपकरणों के द्वारा सादे समझने में आसान के रूप में वर्णित है, और अभिव्यक्ति की एक सादगी के साथ किया जाता है Deshpande के मुताबिक,कन्होपत्रा की कविता और Woman रचनात्मक अभिव्यक्ति का उदय, लैंगिक समानता की भावना वरकारि परंपरा द्वारा लागू द्वारा प्रज्वलित ""Dalit की जागृति"" को दर्शाता है कन्होपत्रा के अभंगा अक्सर अपने पेशे और विठोबा के प्रति उसकी Bhakti वरकारि के संरक्षक देवता के बीच उसके संघर्ष को चित्रित है वह खुद को एक Woman को गहरा उसे उसे उसके पेशे के असहनीय बंधन से बचाने के लिए विठोबा के लिए समर्पित है, और निवेदन करना के रूप में प्रस्तुत करता हैकन्होपत्रा उसका अपमान और समाज से उसके निर्वासन अपने पेशे और Social कद के कारण के बोलति है नाको में देवराय अन्ता आता पर माना जाता है उसके जीवन-असमर्थ उसे भगवान से अलग होने के बारे में सोचा सहन करने की अंतिम अभंगा होने के लिए, कन्होपत्रा उसके दुख को समाप्त करने के विठोबा भी जन्म देती हैविरासत और स्मरणकन्होपत्रा औपचारिक रूप से संतों की सूची में शामिल किया गया है, पाठ Bhaktiविजय में मराठी में संतों अर्थ दिया गया हैसन्दर्भhttp://premikan.com/2009/08/sant-kanhopatra/http://marathi.mangalwedha.com/Home/shri_sant_chokhamela/sri-sant-kanhopatrahttp://www.aathavanitli-gani.com/Natak/Sant_Kanhopatrahttp://godivinity.org/kanhopatra/"
