,mixed_corpus
0,"फूलन देवी (10 अगस्त 1963 - 25 जुलाई 2001) डकैत से Member of parliament बनी एक India की एक Politician थीं एक निम्न वर्ग में उनका जन्म Uttar Pradesh के एक छोटे से गाँव गोरहा का पूर्वा में एक मल्लाह के घर हुअा था फूलन की शादी ग्यारह साल की उम्र में हुई थी लेकिन उनके Pati (title) और Pati (title) के Family ने उन्हें छोड़ दिया था अधिक जानने के लिए यहाँ click करेंबेहमई में हुआ हादसाफूलन को बेहमई गांव में एक घर के एक कमरे में बंद कर दिया गया था तीन सप्ताह की अवधि में कई उच्च Caste के ठाकुर{राजपूत } पुरुषों के उत्तराधिकार द्वारा उसे पीटा गया, बलात्कार किया गया और अपमानित किया गया उन्होंने उसे गाँव के चारों ओर नग्न कर घूमा दियाइसके बाद वह तीन सप्ताह की कैद से भागने में सफल रहीं |बेहमई में नरसंहारबेहमाई से भागने के कई महीनों बाद, फूलन बदला लेने के लिए गाँव लौटी 14 फरवरी 1981 की शाम को, उस समय जब गांव में एक शादी चल रही थी, फूलन और उसके गिरोह ने पुलिस अधिकारियों के रूप में पहनी हुई बेहमई में शादी की फूलन ने मांग की कि उनके ""श्री राम"" और ""लाला राम"" को उत्पीड़ित किया जाए [उद्धरण वांछित] उन्होंने कथित तौर पर कहा, दो व्यक्तियों को नहीं मिला और इसलिए देवी ने गाँव के सभी युवकों को गोल कर दिया और एक कुएँ से पहले एक लाइन में खड़ा कर दिया फिर उन्हें फाइल में नदी तक ले जाया गया हरे तटबंध पर उन्हें घुटने टेकने का आदेश दिया गया गोलियों की बौछार हुई और 22 लोग मारे गए बेहमई नरसंहार ने पूरे देश में आक्रोश पैदा किया Uttar Pradesh के तत्कालीन मुख्यमंत्री वी पी सिंह ने बेहमाई हत्याओं के मद्देनजर इस्तीफा दे दिया [१५] एक विशाल पुलिस अभियान शुरू किया गया था, जो फूलन का पता लगाने में विफल रहा था यह कहा जाने लगा कि मानहुंट सफल नहीं था क्योंकि फूलन को इस क्षेत्र के गरीब लोगों का समर्थन प्राप्त था; रॉबिन हुड मॉडल की कहानियां मीडिया में घूमने लगीं फूलन को बैंडिट क्वीन कहा जाने लगा, और उसे Indiaीय मीडिया [12] के वर्गों द्वारा एक निडर और अदम्य महिला के रूप में महिमामंडित किया गया, जो दुनिया में जीवित रहने के लिए संघर्ष कर रही थीआत्मसमर्पण और जेल की अवधिबेहमई नरसंहार के दो साल बाद भी पुलिस ने फूलन को नहीं पकड़ा था इंदिरा गांधी सरकार ने आत्मसमर्पण पर बातचीत करने का फैसला किया इस समय तक, फूलन की तबीयत खराब थी और उसके गिरोह के अधिकांश सदस्य मर चुके थे, कुछ पुलिस के हाथों मारे गए थे, कुछ अन्य प्रतिद्वंद्वी गिरोह के हाथों मारे गए थे फरवरी 1983 में, वह अधिकारियों को आत्मसमर्पण करने के लिए सहमत हुई हालांकि, उसने कहा कि उसे Uttar Pradesh पुलिस पर भरोसा नहीं है और उसने जोर देकर कहा कि वह केवल मध्य प्रदेश पुलिस के सामने आत्मसमर्पण करेगी उसने यह भी आग्रह किया कि वह महात्मा गांधी और हिंदू देवी दुर्गा की तस्वीरों के सामने अपनी बाहें रखेगी, पुलिस के सामने नहीं [१६] उसने चार और शर्तें रखीं:एक वादा कि आत्मसमर्पण करने वाले उसके गिरोह के किसी भी सदस्य पर मृत्युदंड नहीं लगाया जाएगागिरोह के अन्य सदस्यों के लिए कार्यकाल आठ वर्ष से अधिक नहीं होना चाहिएजमीन का एक प्लॉट उसे दिया जाएउसके पूरे Family को पुलिस द्वारा उसके आत्मसमर्पण समारोह का गवाह बनाया जाना चाहिएएक निहत्थे पुलिस प्रमुख ने उनसे चंबल के बीहड़ों में मुलाकात की उन्होंने मध्य प्रदेश के भिंड की यात्रा की, जहाँ उन्होंने गांधी और देवी दुर्गा के चित्रों के समक्ष अपनी राइफल रखी दर्शकों में मध्य प्रदेश के तत्कालीन मुख्यमंत्री अर्जुन सिंह के अलावा लगभग 10,000 लोग और 300 पुलिसकर्मी शामिल थे उसके गिरोह के अन्य सदस्यों ने भी उसी समय उसके साथ आत्मसमर्पण कर दियाBanditry (दस्यु) और अपहरण के तीस आरोपों सहित फूलन पर अड़तालीस अपराधों का आरोप लगाया गया था उसके मुकदमे को ग्यारह साल की देरी हो गई, इस दौरान वह एक उपक्रम के रूप में जेल में रहा इस अवधि के दौरान, उन्हें डिम्बग्रंथि अल्सर के लिए ऑपरेशन किया गया और एक हिस्टेरेक्टॉमी से गुजरना पड़ा अस्पताल के डॉक्टर ने कथित तौर पर मजाक में कहा कि ""हम फूलन देवी को अधिक फूलन देवी नहीं बनाना चाहते हैं"" [१ reported] अंत में उसे निषाद समुदाय के नेता विशम्भर प्रसाद निषाद, (नाविकों और मछुआरों के मल्लाह समुदाय का दूसरा नाम) के हस्तक्षेप के बाद 1994 में पैरोल पर रिहा किया गया था Mulayam Singh Yadav के नेतृत्व वाली Uttar Pradesh सरकार ने उनके खिलाफ सभी मामलों को वापस ले लिया इस कदम ने पूरे India में सदमे की लहर भेज दी और सार्वजनिक चर्चा और विवाद का विषय बन गयाआमतौर पर फूलनदेवी को डकैत के रूप में (रॉबिनहुड) की तरह गरीबों का पैरोकार समझा जाता था सबसे पहली बार (1981) में वे राष्ट्रीय और अंतर्राष्ट्रीय सुर्खियों में तब आई जब उन्होने ऊँची Casteयों के बाइस लोगों का एक साथ तथाकथित (नरसंहार) किया जो (ठाकुर) Caste के (ज़मींदार) लोग थे लेकिन बाद में उन्होने इस नरसंहार से इन्कार किया थाबाद में Uttar Pradesh और मध्य प्रदेश सरकार तथा प्रतिद्वंदी गिरोहों ने फूलन को पकड़ने की बहुत सी नाकाम कोशिशे की इंदिरा गाँधी की सरकार ने (1983) में उनसे समझौता किया की उसे (मृत्यु दंड) नहीं दिया जायेगा और उनके Family के सदस्यों को कोई नुकसान नहीं पहुँचाया जायेगा और फूलनदेवी ने इस शर्त के तहत अपने दस हजार समर्थकों के समक्ष आत्मसमर्पण कर दियाबिना मुकदमा चलाये ग्यारह साल तक जेल में रहने के बाद फूलन को 1994 में Mulayam Singh Yadav की सरकार ने रिहा कर दिया ऐसा उस समय हुआ जब Dalit लोग फूलन के समर्थन में गोलबंद हो रहे थे और फूलन इस समुदाय के Symbol के रूप में देखी जाती थी फूलन ने अपनी रिहाई के Buddhism में अपना धर्मातंरण किया 1996 में फूलन ने Uttar Pradesh के भदोही सीट से (लोकसभा) चुनाव जीता और वह संसद  तक पहुँची 25 जुलाई सन 2001 को Delhi में उनके आवास पर फूलन की हत्या कर दी गयी उसके Family में सिर्फ़ उसके Pati (title) उम्मेद सिंह हैं शेखर कपूर ने माला सेन की 1993 की पुस्तक India की बैंडिट क्वीन: द ट्रू स्टोरी ऑफ़ फूलन देवी पर आधारित फूलन देवी के जीवन के बारे में उनके 1983 के आत्मसमर्पण के बारे में बताया हालांकि फूलन देवी फिल्म में नायिका हैं, लेकिन उन्होंने इसकी सटीकता पर विवाद किया और इसे India में प्रतिबंधित करने के लिए संघर्ष किया यहां तक ​​कि उसने एक थिएटर के बाहर खुद को आत्मदाह करने की धमकी दी कि अगर फिल्म वापस नहीं ली गई आखिरकार, निर्माता चैनल 4 द्वारा उसे £ 40,000 का भुगतान करने के बाद उसने अपनी आपत्तियाँ वापस ले लीं फिल्म ने उन्हें अंतर्राष्ट्रीय स्तर पर पहचान दिलाई लेखक-कार्यकर्ता अरुंधति रॉय ने अपनी फिल्म समीक्षा में ""द ग्रेट इंडियन रेप ट्रिक"" शीर्षक से कहा, ""restage the rape of a living woman without her permission"",के अधिकार पर सवाल उठाया, और शेखर कपूर पर फूलन देवी का शोषण करने और उसके जीवन और उसकी गलत व्याख्या करने का आरोप लगायाDelhi के तिहाड़ जेल में कैद अपराधी Sher Singh Rana ने फूलन की हत्या की हत्या से पहले वह देश की सबसे सुरक्षित मानी जाने वाली तिहाड़ जेल से फर्जी तरीके से जमानत पर रिहा होने में कामयाब हो गया हत्या के बाद शेर सिंह फरार हो गया कुछ समय बाद शेर सिंह ने एक वीडियो क्िलप जारी करके अंतिम हिन्दू सम्राट पृथ्वीराज चौहान की समाधी ढूढंकर उनकी अस्थियां India लेकर आने की कोशिश का दावा किया हालांकि बाद में Delhi पुलिस ने उसे पकड़ लिया फूलन की हत्या का राजनीतिक षडयंत्र भी माना जाता है उनकी हत्या के छींटे उसके Pati (title) उम्मेद सिंह पर भी आए और फूलन के Family वाले उन्हें पीट भी चुके हैं हालांकि उम्मेद आरोपित नहीं हुआ"
