,mixed_corpus
0,उपमन्यु चटर्जी  English language के विख्यात साहित्यकार हैं इनके द्वारा रचित एक Novel The Mammaries of the Welfare State  के लिये उन्हें सन् 2004 में साहित्य अकादमी पुरस्कार से सम्मानित किया गया सन्दर्भ 
1,"मलय रायचौधुरी (जन्म २९ अक्टूबर १९३९) (মলয় রায়চৌধুরী) बांग्ला साहित्य के प्रख्यात Poet एवम आलोचक है वे साठ के दशक के सहित्य आन्दोलन Hungry generation (हंगरी जनरेशन) के जन्मदाता माने जाते है इस आन्दोलन ने बांग्ला साहित्य को एक नयी दिशा दी और पूरे India में उथलपुथल मचायीआन्दोलन के सिलसिले में मलय को उनहे Poetता लिखने के कारण कारावास का दण्ड मिला था वे अब तक सत्तर से ज्यादा Poetताग्रन्थ, नाटक, उपन्यास एवम अनुवद के पुस्तक लिख चुके हैं साठ के दशक मे जो बदलाव बांगला Poetता मे आये, उन में एक बड़ा योगदान मलय रायचौधुरी का रहा है उनके काव्यग्रन्थो मे ख्याति प्राप्त हैं मेधार वतानुकूल घुन्गुर २००३ में उन्हें अनुवाद के लिये साहित्य अकादमी पुरस्कार से नवाजा गया थापृष्ठभूमिमलय रायचौधुरीका जन्म Bihar राज्यके पटना शहरमें एक ब्राह्मण परिवारमें हुया जो वहां पचास सालसे भी ज्यादा समयसे इमलितला (बाखरगंज) नामके बहुतही गरीब मुहल्ले में निम्नबर्गके हिन्दु और शिया मुसलमानोंके साथ रहते थे यह परिवेशका प्रभाव उनके चिन्तन एवम लेखनमें पडा भुखी पीढी का जन्म एक तरहसे उनके इस परिवेश का अवदान कहा जा सकता है उनके पिता रंजित रायचौधुरी पटना शहरके काफि पुरानि फोटोग्राफि तथा चित्रकारी संस्था रायचौधुरी ऐन्ड कंके जानेमाने शिल्पी थे पिताके बडे भाइ प्रमोद रायचौधुरी थे पटना मिउजियमके किपर ऑफ पेइनटिंस ऐन्ड स्कल्पचर मलय रायचौधुरीके घरमें शास्त्रीय संगीत का आदर था क्यों कि उनके दोनों बडी बहने शस्त्रीय संगीत में माहिर थे घरमें हर प्रकार के कला का आदर था मलय रायचौधुरीके माता अमिता बन्द्योपाध्याय आये थे २४ परगणास्थित पानिहटि गांवके शिक्षित परिवार से, जिनके पुरुषोंमें ब्राह्मोसमाजका गभीर प्रभाव था मलयका स्कुली शिक्षा पहले सेन्ट जोसेफ्स कान्वेन्ट और बादमें राममोहन राय सेमनरिमें हुया पटना विश्वविद्यालयसे वे बिए अनर्स तथा एमए किये एमए पढ्ते समयही वे उनका पहला किताब मार्कसवादेर उत्तराधिकार लिखना शुरु किया था Shakti Chattopadhyayके साथ मतान्तरके कारण यह किताब प्रकाशित होनेके बाद एक कापि रख कर बाकि सब जला दिये गये थे मध्यान्तरमें मलय Poetता लिखना शुरु किये थे Poetता लिखते समय वह महसुस किये थे कि बांग्ला साहित्य उचितरूपसे उपनिवेशके बादका परिसर प्रतिबिम्बित नहीं कर पा रहा है एवम पुरे व्यवस्था को झक्झोर देनेके लिये एक साहित्यिक आंदोलन बहुतही जरुरि है वह अप्ने बडे भाइ Samir Roychoudhuryके साथ आलोचनाके पश्चात अपने मित्र Subimal Basak जो कि पटना निवासी थे और Debi Royको पुरे कार्यक्रम का ब्योरा दिया बचपन से ही फणीश्वर नाथ 'रेणु' के साथ मलयके परिवार का परिचय था वे उन्के पथप्रदर्शक रहें कानवेन्टमे पढाइके कारण मलयको बाइबल, ओलड एवम निउ टेस्टामेन्ट के कहानियां काम आये जब वह कालेजमें अंग्रेजी पाठके समय ब्रिटिश Poet जिओफ्रे चौसर के काउनटरबेरि टेलससे भुखी पीढी आंदोलनके 'भुख अविधाका एक नया आयाम पाया चौसरने ही कहा था इन दि सावर हंगरी टाइम मार्कसवाद पर किताब लिखते समय मलय परिचित हुये थे जर्मन दार्शनिक आस्वल्ड स्पेंगलरके दि डिक्लाइन ऑफ दि वेस्ट ग्रन्थ से, जिस्के दर्शन, उनको लगा था, Indiaीय उत्तरऔपनिवेशिक स्थितिको सही-सही व्याख्या करता है उनहोने एक पन्ने का मैनिफेस्टो पटनामें ही १९६१के नवम्बर में निकाला और Debi Royको भेजा कोलकातामें वितरित करने के लिये उसके बाद जो हुया वह तो केवल बांग्ला नहीं, Indiaीय साहित्य का महत्वपूर्ण इतिहास हैमलय का साहित्यमलय रायचौधुरीका भूखी पीढी का दौर साठ के दशक तक ही चला इसका प्रधान कारण यह है कि उनके खिलाफ जो मुकदमा चला था उसमें उनके आंदोलन के बन्धुगण, जैसे कि शैलेश्वर घोष, सुभाष घोष, उत्पलकुमार बसु, Shakti Chattopadhyay, सन्दीपन चट्टोपाध्याय उनके विरुद्ध सरकारी गवाह बन बैठे थे कहा जा सकता है कि भूखी पीढी आंदोलन इन लोगों के सरकारी गवाह होने पर बिखर गया मलय के लिये यह सचेत होने का पथ बना वे अकेले अपने-आप में साहित्य का एक जगत बना कर चल दिये उनके लेखनप्रक्रिया में भी परिवर्तन आया उन्होंने करीब दस साल पढाई में बिताया और एक नवीण रूप में कोलकाता आये उनकी Poetता, कहानीयाँ, उपन्यास, इत्यादि सम्पूर्णत: अलग थे इस नये दौर को लोगों ने अधुनान्तिक दौर कहा है मलय अपने नये रूप में थे Multiculturalism के कट्टर समर्थक जो उनके लेखन में पूरी तरह झलकता है और यह है उनके बचपन में बिताये हुए इमलितला के परिवेश की देन कोलकाता के साहित्य बाजार में चलनेवाले बिकाउ-लेखन से एक अलग ही जगत है उनका वह परवाह नहीं करते कि उनके किताबें हजारों की संख्या में बिके परन्तु उनका एक पाठक-समाज बन गया है जो उनके पुस्तकों को ढून्ढ ही लेते हैं कोलकाता विश्वविद्यालय के बांग्ला भाषा विभाग के प्रधान डाक्टर तरुण मुखोपाध्याय का कहना है कि मलय अपने नये रूप में साहित्य में ताजे हवा को तूफान में बदलने वाले झोंके की तरह हैंफिल्मचित्र परिचालक श्रीजित मुखर्जी बाइशे श्राबोण नामसे एक फिल्म बनायी हैं जिसमें Poet मलय रायचौधुरीको चित्रित किया गया है मलयके चरित्र में अभिनय किया है जाने-माने परिचालक गौतम घोषभुखी पीढी सृजनकर्मों का कापिराइटभुखी पीढी आंदोलनकारियों के सृजनकर्मों का कापिराइट नहीं होता है उन लोगों का कहना है कि India में यदि महाIndia, Ramayana, गीता, रामचरितमानस आदि का कापिराइट कभी था ही नहीं तो हम क्यों यह उपनिवेशवादी अवधारणा को स्वीकारें मलय रायचौधुरी के किताबों में यह घोषणा लिखा रहता हैकृतियांमार्कसबादेर उत्तराधिकार (१९६२)शयतानेर मुख (१९६४) काव्यग्रन्थआमार जेनरेशनेर काव्यदर्शन (१९६४) भुखी पीढी आन्दोलन के दर्शनजखम (१९६५) दीर्घ Poetताइसताहार संकलन (१९८५) भुखी पीढी के मेनिफेस्टों का संकलनPoetता संकलन (१९८६) भुखी पीढी आन्दोलन के समय लिखित Poetतायेंमेधार वातानुकुल घुंगुर (१९८७) काव्यग्रन्थहाततालि (१९८९) दीर्घ Poetताचितकारसमग्र (१९९५) काव्यपुस्तिकाक्षत्रखान (१९९५) Poetतापुस्तिका,जा लागबे बोलबेन (१९९६) काव्यग्रन्थअ (१९९८) अपने Poetतयों का विश्लेषणआत्मध्वंसेर सहस्राब्द (२०००) काव्यग्रन्थभेन्नोगल्पो (१९९६) कहानियों का संकलनडुबजले जेटुकु प्रश्वास (१९९४) उपन्यासजलाण्ंजलि (१९९६) उपन्यासनामगन्ध (१९९९) उपन्यासनाटकसमग्र (१९९४) भुखी पीढी के समय लिखे गये नाट्कों का संकलनहंगरी किंवदन्ति (१९९४) भुखी पीढी आन्दोलन क स्मृतिलेखपोस्टमडर्निजम नव्योत्तर काल (१९९५) शोधकार्यपरावस्तवबाद (१९९७)Modernism एर विरुध्दे कथाबात्रा (१९९९) मनन-चिन्तनमतान्तर (२०००) प्रचलित चिन्तओं पर टिप्पणियांहंगरी साक्षातकारमाला (१९९९) लघु पत्रिकायों में प्रकाशित साक्षातकारों का संकलनलपोस्टमोडर्न नव्योत्तर काल कालखण्ड ओ बांगालिर पतन (२०००) बंगालि समाज के पतन पर एक विश्लेषणउत्तराऔपनिवेशिक पोस्टमोडर्निजम (२००१) मूल्याँ के विघटन पर आलोचनाअप्रकाशित गल्पो (२००८) कहानीयांतिनटि उपन्यास (२०१०) एक साथ तीन उपन्यासेंअतिवास्तव गल्पोगाचा (२००८) अधुनान्तिक कहानीयांPoetतासमग्र (२००५) १९६१ से २००४ तक लिखे सारे Poetतायेंप्रबन्धसमग्र - प्रथम खण्ड (२०११)अनुवादसूर्जो ओ नरकेर बिबाहो (१९९८) William Blakeआगन्तुक (१९९३) मारियो भारगास योसाट्रान्ससाइबेरियन एक्सप्रेस (१९९७) ब्लाइजि संदरात्रिस्तान जारा (१९९६) Dada के Poetतायेंजँ काकतो (१९९६) क्रुसिफिकशनऐलन गिंसबर्ग (१९९५) कैडिशऐलन गिंसबर्ग (१९९६) हाउल एवम अन्य Poetतायेंत्रिस्तान जारा (२००२) Dada के मैनिफेस्टोDharamvir Bharati (२००३) सुरज का सातवाँ घोडा अनुवाद के लिये साहित्य अकादमी पुरस्कार-प्राप्तसिरियाइ Poet अदुनिस के Poetतायें (२०१०)आलोचना और जीवनीपाल गौंगा (१९९९)शार्ल बादलेयर (१९९८)जँ आर्तुर रेंबो (१९९९)Allen Ginsberg (२०००)सालवादोर दालि (२००१)जेमस जायस (२०१०)जँ जेने (२०१०)आना आखमातोभा (२००९)सन्दर्भमलय रायचौधुरी विशेष संख्या, ह्वा ४९ (अप्रैल २००१) मुर्शिद अलि मन्डल सम्पादित विश्लेशकगण: तपोधीर भट्टचार्जि, कलिम खान, विश्वजित सेन, सत्यजित बन्दोपाध्याय, अजित राय, पार्थप्रतिम बन्दोपाध्याय, Subimal Basak, अरुणकुमार चट्टोपध्याय, जाहिरुल हसन, गौतम सेनगुप्ता, समीर सेनगुप्ता, बारीन घोषाल, उदयन घोष, शुभंकर दाश, समरजित सिनहा, Samir Roychoudhury, यशोधरा रायचौधुरी, शान्तनु बन्दोपाध्याय, रफिक उल इसलाम, उतपलकुमार बसु, तपनकुमार माइति, अरूप चौधुरी, मीजानुर रहमान, शंकरनाथ चक्रबर्ती, सलिला रायचौधुरी, अनुश्री प्रशन्त, फणिश्वर नाथ 'रेणु', शिबनारायन राय, विमलकुमार मुखोपाध्याय, मनोज नन्दी, अरविन्द प्रधान एवम प्रवीर चक्रवर्तीमलय रायचौधुरी विषेश संख्या, आहबकाल (१९९९) रतनकुमार विश्वास सम्पादितवन तुलसी का गन्ध (१९८४) फणीश्वर नाथ 'रेणु'स्वप्न मलय रायचौधुरी विशेष संख्या (२००८) सम्पादक: डक्टर विष्णुचन्द्र दे विश्लेषकगण: अनुपम मुखोपाध्याय, डक्टर तरुण मुखोपाध्याय, अध्यापक शीतल चौधुरी, डक्टर शंकर भट्टाचार्या, पिनासी राजस्थानी, राणा चट्टोपाध्याय, श्यामल शील एवम डक्टर विष्णुचन्द्र देMalay Roy Choudhury by Hardmod Carlyle Nicolas. Crypt Publishing (2011). ISBN - 10:613690541 Amazon.com ISBN - 13: 978-6136905419.STARK ELECTRIC JESUS (1965 edition) विवादित Poetता का अनुवाद Amazon.com मूल्ञ $250.इन्हें भी देखेंShakti ChattopadhyaySubimal BasakFalguni RoyDebi Royविनय मजुमदारSamir Roychoudhuryबासुदेब दाशगुप्तात्रिदिब मित्राHungry generation (हंगरी जनरेशन)प्रदीप चौधुरीबाह्यसूत्रमलय रायचौधुरी को लिखे बीटनिक Poetयों के खतमलय रायचौधुरी के लिखे Poetतायों का अंग्रेजी में अनुवादमलय रायचौधुरी के दिये हुये साक्षातकारदिवाकर ए पी पाल कृत मोटर बाइक Poetता का अनुवाददिवाकर ए पी पाल कृत प्रत्याघात Poetता का अनुवादमलय रायचौधुरी द्वरा यु ट्युब पर 'प्रस्तुति' Poetता पाठदिवाकर ए पी पाल द्वारा कृत मलय राय चौधेरी की Poetता ’प्रस्तुति’ का हिंदी अनुवाद"
2,"जॉर्ज ऑरवेल (अंग्रेज़ी: George Orwell, मूल नाम एरीक अर्तुर ब्लेर, Eric Arthur Blair; 25 जून 1903 - 21 जनवरी 1950) — अंग्रेज़ी लेखक तथा लोक प्रचारकजॉर्ज ऑरवेल (1903-1950) के संबंध में खास बात यह है कि उनका जन्म India में ही बिहार के Motihari नामक स्थान पर हुआ था उनके पिता ब्रिटिश राज की Indiaीय सिविल सेवा के अधिकारी थे ऑरवेल का मूल नाम 'एरिक आर्थर ब्लेयर' था उनके जन्म के साल भर बाद ही उनकी मां उन्हें लेकर इंग्लैण्ड चलीं गयीं थीं, जहां सेवानिवृत्ति के बाद उनके पिता भी चले गए वहीं पर उनकी शिक्षा हुईबर्मा में पुलिस का कामब्लेयर की मातृभूमि मौलमेइन में रहती थी, इसलिए उन्होंने बर्मा में एक पोस्टिंग का चुनाव किया अक्टूबर 1 9 22 में वह बर्मा में Indiaीय इंपीरियल पुलिस में शामिल होने के लिए एसएएस नहर और सीलोन के माध्यम से एसएस हियरफोर्डशायर पर रवाना हुए एक महीने बाद, वह रंगून पहुंचे और मंडले में पुलिस प्रशिक्षण स्कूल चला गया बर्मा के प्रमुख पहाड़ी स्टेशन मेम्यो में एक छोटी पोस्टिंग के बाद, उन्हें 1 9 24 की शुरुआत में इर्राब्दी डेल्टा में मायांगमा के सीमावर्ती चौकी पर तैनात किया गयाएक शाही पुलिसकर्मी के तौर पर काम करना ने उन्हें काफी जिम्मेदारी दी, जबकि उनके समकालीन अधिकांश लोग इंग्लैंड में अभी भी विश्वविद्यालय में थे जब वह डेल्टा से पूर्वी पूर्व में एक उप-विभागीय अधिकारी के रूप में टेंटे में तैनात किया गया था, वह 200,000 लोगों की सुरक्षा के लिए जिम्मेदार था 1 9 24 के अंत में, उन्हें सहायक जिला अधीक्षक के रूप में पदोन्नत किया गया और सीरियम में तैनात किया गया, जो रंगून के करीब था सीरियाम में बर्मा तेल कंपनी की रिफाइनरी थी, ""आसपास के क्षेत्र में बंजर बर्बाद, रिफाइनरी के ढेर से दिन और रात सल्फर डाइऑक्साइड के धुएं से सभी वनस्पति मारे गए"" लेकिन शहर रंगुन के निकट था, एक महानगरीय बंदरगाह था, और ब्लेयर शहर में अक्सर चला गया, ""एक किताबों की दुकान में ब्राउज़ करें, अच्छी तरह से पकाया भोजन खाने के लिए, पुलिस जीवन के उबाऊ दिनचर्या से दूर हो जाओ"""
