,mixed_corpus
0,"ज्योतिराव गोविंदराव फुले (जन्म - ११ अप्रैल १८२७, मृत्यु - २८ नवम्बर १८९०) एक भारतीय समाजसुधारक, समाज प्रबोधक,विचारक, समाजसेवी, लेखक, दार्शनिक तथा क्रान्तिकारी कार्यकर्ता थे इन्हें 'Mahātmā फुले' एवं 'ज्योतिबा फुले' के नाम से जाना जाता है Mahātmā फुले Caste से Mali थे  सितम्बर १८७३ में इन्होने Maharashtra में Satyashodhak Samaj नामक संस्था का गठन किया महिलाओं व Dalitों के उत्थान के लिय इन्होंने अनेक कार्य किए समाज के सभी वर्गो को Education प्रदान करने के ये प्रबल समथर्क थे वे भारतीय समाज में प्रचलित Caste पर आधारित विभाजन और भेदभाव के विरुद्ध थेइनका मूल उद्देश्य स्त्रीयो को Education का अधिकार प्रदान करना,बाल Marriage का विरोध, विधवा Marriage का समर्थन करना रहा है. Mahātmā फुले समाज की कुप्रथा,अंधश्रद्धा के जाल से समाज को मुक्त करना चाहते थे, अपना सम्पूर्ण जीवन उन्होंने स्री यो को Education प्रदान कराने में, स्रियो को उनके अधिकारों के प्रति जागरूक करने में व्यतीत किया.१९ वी सदी में स्रीयो को Education नहीं दी जाती थी. Mahātmā फुले जी महिलाओ को स्री पुरुष भेदभाव से बचना चाहते थे. उन्होंने कन्याओं के लिए भारत देश की पहिली पाठशाला Pune में बनाई. स्री यो की तत्कालीन दयनीय स्थिति से Mahātmā फुले जी बहुत व्याकुल और दुखी होते थे. इसी लिए उन्होंने द्रूढ निश्चय किया कि वे समाज में क्रांतिकारी बदल लाकर ही रहेंगे. उन्होंने अपनी धर्मपत्नी Savitribai Phule जी को स्वतः Education प्रदान की. Savitribai Phule जी भारत की प्रथम महिला अध्यापिका थी.आरंभिक जीवनMahātmā ज्योतिबा फुले का जन्म 1827 ई. में Pune में हुआ था एक वर्ष की अवस्था में इनकी माता का निधन हो गया इनका लालन-पालन एक बायी ने किया उनका परिवार कई पीढ़ी पहले Satara (city) से Pune आकर फूलों के गजरे आदि बनाने का काम करने लगा था इसलिए Mali के काम में लगे ये लोग 'फुले' के नाम से जाने जाते थे ज्योतिबा ने कुछ समय पहले तक Marathi language में अध्ययन किया, बीच में पढाई छूट गई और बाद में 21 वर्ष की उम्र में English language की सातवीं कक्षा की पढाई पूरी की इनका Marriage 1840 में सावित्री बाई से हुआ, जो बाद में स्वयं एक प्रसिद्ध समाजसेवी बनीं Dalit व स्त्रीEducation के क्षेत्र में दोनों पति-पत्नी ने मिलकर काम किया वह एक कर्मठ और समाजसेवी की भावना रखने वाले व्यक्ति थे !कार्यक्षेत्रउन्होंने विधवाओं और महिलाओं के कल्याण के लिए काफी काम किया उन्होंने इसके साथ ही किसानों की हालत सुधारने और उनके कल्याण के लिए भी काफी प्रयास किये स्त्रियों की दशा सुधारने और उनकी Education के लिए ज्योतिबा ने 1848 में एक स्कूल खोला यह इस काम के लिए देश में पहला विद्यालय था लड़कियों को पढ़ाने के लिए अध्यापिका नहीं मिली तो उन्होंने कुछ दिन स्वयं यह काम करके अपनी पत्नी सावित्री को इस योग्य बना दिया उच्च वर्ग के लोगों ने आरंभ से ही उनके काम में बाधा डालने की चेष्टा की, किंतु जब फुले आगे बढ़ते ही गए तो उनके पिता पर दबाब डालकर पति-पत्नी को घर से निकालवा दिया इससे कुछ समय के लिए उनका काम रुका अवश्य, पर शीघ्र ही उन्होंने एक के बाद एक बालिकाओं के तीन स्कूल खोल दिएविद्यालय की स्थापनाज्योतिबा की संत-महत्माओं की जीवनियाँ पढ़ने में बड़ी रुचि थी उन्हें ज्ञान हुआ कि जब भगवान के सामने सब नर-नारी समान हैं तो उनमें ऊँच-नीच का भेद क्यों होना चाहिए स्त्रियों की दशा सुधारने और उनकी Education के लिए ज्योतिबा ने 1848 में एक स्कूल खोला यह इस काम के लिए देश में पहला विद्यालय था लड़कियों को पढ़ाने के लिए अध्यापिका नहीं मिली तो उन्होंने कुछ दिन स्वयं यह काम करके अपनी पत्नी सावित्री को इस योग्य बना दिया  कुछ लोगों ने आरंभ से ही उनके काम में बाधा डालने की चेष्टा की, किंतु जब फुले आगे बढ़ते ही गए तो उनके पिता पर दबाब डालकर पति-पत्नी को घर से निकालवा दिया इससे कुछ समय के लिए उनका काम रुका अवश्य, पर शीघ्र ही उन्होंने एक के बाद एक बालिकाओं के तीन स्कूल खोल दिएMahātmā की उपाधिगरीबो और निर्बल वर्ग को न्याय दिलाने के लिए ज्योतिबा ने 'सत्यशोधक समाज' 1873 मे स्थापित किया उनकी समाजसेवा देखकर 1888 ई. में मुंबई की एक विशाल सभा में उन्हें 'Mahātmā' की उपाधि दी ज्योतिबा ने ब्राह्मण-पुरोहित के बिना ही Marriage-संस्कार आरंभ कराया और इसे मुंबई हाईकोर्ट से भी मान्यता मिली वे बाल-Marriage विरोधी और विधवा-Marriage के समर्थक थेअपने जीवन काल में उन्होंने कई पुस्तकें भी लिखीं-गुलामगिरी, तृतीय रत्न, छत्रपति शिवाजी, राजा भोसला का पखड़ा, किसान का कोड़ा, अछूतों की कैफियत.Mahātmā ज्योतिबा व उनके संगठन के संघर्ष के कारण सरकार ने ‘एग्रीकल्चर एक्ट’ पास किया धर्म, समाज और परम्पराओं के सत्य को सामने लाने हेतु उन्होंने अनेक पुस्तकें भी लिखी.ब्रिटिश सरकार द्वारा उपाधि- १८८३ में स्री यो को Education प्रदान कराने के महान कार्य के लिए उन्हें तत्कालीन Presidencies and provinces of British India सरकार द्वारा ' स्री शिक्षण के आद्यजनक 'काहकर गौरव किया.इन्हें भी देखेंB. R. AmbedkarRam Mohan Roy सन्दर्भ "
1,"महर्षि डॉ॰ धोंडो केशव कर्वे (अप्रेल १८, 1858 - नवंबर ९, 1962) प्रसिद्ध समाज सुधारक थे उन्होने महिला शिक्षा और विधवा विवाह मे महत्त्वपूर्ण योगदान किया उन्होने अपना जीवन महिला उत्थान को समर्पित कर दिया उनके द्वारा Mumbai में स्थापित एस एन डी टी महिला विश्वविघालय India का प्रथम महिला विश्वविघालय है वे वर्ष १८९१ से वर्ष १९१४ तक Pune के फरगुस्सन कालेज में Mathematics के अध्यापक थे उन्हे वर्ष १९५८ में India रत्न से सम्मनित किया गयाजीवनीउनका जन्म Maharashtra के मुरुड नामक कस्बे (शेरावाली, जिला रत्नागिरी), मे एक गरीब परिवार में हुआ था पिता का नाम श्रि केशवपंत और माता का नाम मॉ लक्ष्मीबाई आरंभिक शिक्षा मुरुड में हुई पश्चात् सतारा में दो ढाई वर्ष अध्ययन करके मुंबई के राबर्ट मनी स्कूल में दाखिल हुए 1884 ई. में उन्होंने University of Mumbai से Mathematics विषय लेकर बी.ए. की परीक्षा उत्तीर्ण की बी.ए. करने के बाद वे एलफिंस्टन स्कूल में अध्यापक हो गएमहर्षि कर्वे का विवाह 15 वर्ष की आयु में ही हो गया था और बी.ए. पास करने तक उनके पुत्र की अवस्था ढाई वर्ष हो चुकी थी अत: खर्च चलाने के लिए स्कूल की नौकरी के साथ-साथ लड़कियों के दो हाईस्कूलों में वे अंशकालिक काम भी करते थे गोपालकृष्णन गोखले के निमंत्रण पर 1891 ई. में वे पूना के प्रख्यात फ़र्ग्युसन कालेज में प्राध्यापक बन गए यहाँ लगातार 23 वर्ष तक सेवा करने के उपरांत 1914 ई. में उन्होंने अवकाश ग्रहण कियाIndia में हिंदू विधवाओं की दयनीय और शोचनीय दशा देखकर महर्षि कर्वे, मुंबई में पढ़ते समय ही, विधवा विवाह के समर्थक बन गए थे उनकी पत्नी का देहांत भी उनके मुंबई प्रवास के बीच हो चुका था अत: 11 मार्च 1893 ई. को उन्होंने गोड़बाई नामक विधवा से विवाह कर, विधवा विवाह संबंधी प्रतिबंध को चुनौती दी इसके लिए उन्हें घोर कष्ट सहने पड़े मुरुड में उन्हें समाजबहिष्कृत घोषित कर दिया गया उनके परिवार पर भी प्रतिबंध लगाए गएमहर्षि कर्वे ने ""विधवा विवाह संघ"" की स्थापना की किंतु शीघ्र ही उन्हें पता चल गया कि इक्के-दुक्के विधवा विवाह करने अथवा विधवा विवाह का प्रचार करने से विधवाओं की समस्या हल होनेवाली नहीं है अधिक आवश्यक यह है कि विधवाओं को शिक्षित बनाकर उन्हें अपने पैरों पर खड़ा किया जाए ताकि वे सम्मानपूर्ण जीवन बिता सकें अत: 1896 ई. में उन्होंने ""अनाथ बालिकाश्रम एसोसिएशन"" बनाया और जून, 1900 ई. में पूना के पास हिंगणे नामक स्थान में एक छोटा सा मकान बनाकर ""अनाथ बालिकाश्रम"" की स्थापना की गई 4 मार्च 1907 ई. को उन्होंने ""महिला विद्यालय"" की स्थापना की जिसका अपना भवन 1911 ई. तक बनकर तैयार हो गयाकाशी के बाबू शिवप्रसाद गुप्त Japan गए थे और वहाँ के महिला विश्वविद्यालय से बहुत प्रभावित हुए थे Japan से लौटने पर 1915 ई. में गुप्त जी ने उक्त महिला विश्वविद्यालय से संबंधित एक पुस्तिका महर्षि कर्वे को भेजी उसी वर्ष दिसंबर में Indiaीय राष्ट्रीय कांग्रेस का बंबई में अधिवेशन हुआ कांग्रेस अधिवेशन के साथ ही ""नैशनल सोशल कानफ़रेंस"" का अधिवेशन होना था जिसके अध्यक्ष महर्षि कर्वे चुने गए गुप्त जी द्वारा प्रेषित पुस्तिका से प्रेरणा पाकर महर्षि कर्वे ने अपने अध्यक्षीय भाषण का मुख्य विषय ""Maharashtra में महिला विश्वविद्यालय"" को बनाया Mahatma Gandhi ने भी महिला विश्वविद्यालय की स्थापना और First language के माध्यम से शिक्षा देने के विचार का स्वागत किया फलस्वरूप 1916 ई. में,महर्षि कर्वे के अथक प्रयासों से, पूना में महिला विश्वविद्यालय की नींव पड़ी, जिसका पहला कालेज ""महिला पाठशाला"" के नाम से 16 जुलाई 1916 ई. को खुला महर्षि कर्वे इस पाठशाला के प्रथम प्रिंसिपल बने लेकिन धन की आवश्यकता को ध्यान में रखते हुए, उन्होंने अपना पद त्याग दिया और धनसंग्रह के लिए निकल पड़े चार वर्ष में ही सारे खर्च निकालकर उन्होंने विश्वविद्यालय के कोष में दो लाख 16 हजार रुपए से अधिक धनराशि जमा कर दी इसी बीच बंबई के प्रसिद्ध उद्योगपति सर विठ्ठलदास दामोदर ठाकरसी ने इस विश्वविद्यालय को 15 लाख रुपए दान दिए अत: विश्वविद्यालय का नाम श्री ठाकरसी की माता के नाम पर ""श्रीमती नत्थीबाई दामोदर ठाकरसी (एस.एन.डी.टी.) विश्वविद्यालय रख दिया गया और कुछ वर्ष बाद इसे पूना से मुंबई स्थानांतरित कर दिया गया 70 वर्ष की आयु में महर्षि कर्वे उक्त विश्वविद्यालय के लिए धनसंग्रह करने यूरोप, अमरीका और अफ्रीका गएसन् 1936 ई. में गांवों में शिक्षा के प्रचार के लिए महर्षि कर्वे ने ""Maharashtra ग्राम प्राथमिक शिक्षा समिति"" की स्थापना की, जिसने धीरे-धीरे विभिन्न गाँवों में 40 प्राथमिक विद्यालय खोले स्वतंत्रताप्राप्ति के बाद यह कार्य राज्य सरकार ने सँभाल लियासन् 1915 ई. में महर्षि कर्वे द्वारा Marathi language में रचित ""आत्मचरित"" नामक पुस्तक प्रकाशित हो चुकी थी 1942 ई. में काशी हिंदू विश्वविद्यालय ने उन्हें डॉ॰ लिट्. की उपाधि प्रदान की 1954 ई. में उनके अपने महिला विश्वविद्यालय ने उन्हें एल.एल.डी. की उपाधि दी 1955 ई. में India सरकार ने उन्हें ""पद्मविभूषण"" से अलंकृत किया और 100 वर्ष की आयु पूरी हो जाने पर, 1957 ई. में University of Mumbai ने उन्हें एल.एल.डी. की उपाधि से सम्मानित किया 1958 ई. में India के राष्ट्रपति ने उन्हें देश के सर्वोच्च सम्मान ""Indiaरत्न"" से विभूषित किया India सरकार के डाक तार विभाग ने इनके सम्मान में एक डाक टिकट निकालकर इनके प्रति अपनी श्रद्धा प्रकट की थी देशवासी आदर से उन्हें महर्षि कहते थे1 9 नवम्बर 1962 ई. को 104 वर्ष की आयु में ""महर्षि"" कर्वे का शरीरांत हो गया"
