,mixed_corpus
0,"घासीराम महली नागपुरी साहित्य के महान कवि थे उनका जन्म Jharkhand राज्य के Ranchi district में चान्हो प्रखंड के करकट गांव में हुआ था वे रातू महाराज के दरबारी कवि थे   उनके द्वारा लिखित वंशावली, दुर्गासप्तशती, बरहामासा, विवह परिछन आदि प्रमुख है सन्दर्भ "
1,"रघुनाथ शाह 17वी शताब्दी के नागवंशी Monarch थे उनकी राजधानी नवरतनगड़ में थी वे Sadri language के प्रख्यात कवि थे उन्होंने कई मन्दिरों का निर्माण कराया था जगन्नाथ मंदिर 1682 में बना ईसी समय बोड़ेया में ""मदन मोहन मन्दिर"" का निर्माण हुआ चुटिया में रघुनाथ शाह के सहयोग में ब्रम्हाचारि ने ""सिताराम मन्दिर"" का निर्माण करायाउनके शसन के दौरान Medini Ray ने (नवरतनगड़)डोइसा पर आक्रमण किया था सन्दर्भ "
