,mixed_corpus
0,"Dadu, Pakistanदयाल (1544-1603 ई.) Hindi के भक्तिकाल में ज्ञानाश्रयी शाखा के प्रमुख सन्त कवि थे इनके 52 पट्टशिष्य थे, जिनमें गरीबदास, सुंदरदास, रज्जब और बखना मुख्य हैं Dadu, Pakistan के नाम से 'Dadu, Pakistan पंथ' चल पडा ये अत्यधिक दयालु थे इस कारण इनका नाम 'Dadu, Pakistan दयाल' पड गया Dadu, Pakistan Hindi, Gujaratी, Rajasthanी आदि कई भाषाओं के ज्ञाता थे इन्होंने शबद और साखी लिखीं इनकी रचना प्रेमभावपूर्ण है जात-पाँत के निराकरण, हिन्दू-मुसलमानों की एकता आदि विषयों पर इनके पद तर्क-प्रेरित न होकर हृदय-प्रेरित हैंपरिचयसन्त Dadu, Pakistanदयाल जी महाराज का अवतार संवत् 1601 वि. में भारतवर्ष के Gujarat राज्य के Ahmedabad नगर में हुआ था कहा जाता है कि लोदी राम नामक ब्राह्मण को [साबरमती] में बहता हुआ एक बालक मिला अधेड़ आयु के उपरांत भी लोधीराम के कोई पुत्र नहीं था जिसकी उन्हें सदा लालसा रहती थीएक दिन उन्हें एक सिद्ध संत के दर्शन हुए और उन्होंने अपनी हार्दिक व्यथा उन संत को कह सुनाई संत ने शरणागत जानकर लोधीरम को पुत्र रत्न की प्राप्ति का वरदान दिया और कहा ""साबरमती नदी में तैरते कमल पत्र पर शयन करते बालक को अपने घर ले आना वही तुम्हारा पुत्र होगा"" पुत्र प्राप्ति की कामना लेकर श्री लोधीरम ब्राहमण साबरमती नदी के तट पर गए जहाँ उन्हें पानी पर तैरते कमल पर लेटा हुआ बालक प्राप्त हुआ इस प्रकार शुभमिति फाल्गुन शुक्ल अष्टमी गुरुवार के दिन विक्रम संवत 1601 में संत शिरोमणि सदगुरु श्री Dadu, Pakistan दयाल जी महाराज का अवतार हुआअपनी प्रिय से प्रिय वस्तु परोपकार के लिए तुरंत दे देने के स्वाभाव के कारण उनका नाम “Dadu, Pakistan” रखा गया आप दया दीनता व करुणा के खजाने थे, क्षमा शील और संतोष के कारण आप ‘दयाल’ अतार्थ “Dadu, Pakistan दयाल” कहलायेविक्रम सं. 1620 में 12 वर्ष की अवस्था में Dadu, Pakistanजी गृह त्याग कर सत्संग के लिए निकल पड़े, केवल प्रभु चिंतन में ही लीन हो गए Ahmedabad से प्रस्थान कर भ्रमण करते हुए Rajasthan की आबू पर्वतमाला, तीर्थराज Pushkar से होते हुए करडाला धाम (जिला Jaipur) पधारे और पूरे 6 वर्षों तक लगातार प्रभु की साधना की कठोर साधना से इन्द्र को आशंका हुई की कहीं इन्द्रासन छीनने के लिए तो वे तपस्या नहीं कर रहे , इसीलिए इंद्र ने उनकी साधना में विघ्न डालने के लिए अप्सरा रूप में माया को भेजा जिसने साधना में बाधा डालने के लिए अनेक उपाय किये मगर उस महान संत ने माया में व अपने में एकात्म दृष्टि से बहन और भाई का सनातन प्रतिपादित कर उसके प्रेमचक्र को एक पवित्र सूत्र से बाँध कर शांत कर दियासंत Dadu, Pakistan जी विक्रम सं. 1625 में सांभर पधारे यहाँ उन्होंने मानव-मानव के भेद को दूर करने वाले, सच्चे मार्ग का Upadeśa दिया तत्पश्चात Dadu, Pakistan जी महाराज आमेर पधारे तो वहां की सारी प्रजा और राजा उनके भक्त हो गएउसके बाद वे फतेहपुर सीकरी भी गए जहाँ पर बादशाह अकबर ने पूर्ण भक्ति व भावना से Dadu, Pakistan जी के दर्शन कर उनके सत्संग व Upadeśa ग्रहण करने के इच्छा प्रकट की तथा लगातार 40 दिनों तक Dadu, Pakistanजी से सत्संग करते हुए Upadeśa ग्रहण किया Dadu, Pakistanजी के सत्संग प्रभावित होकर अकबर ने अपने समस्त साम्राज्य में गौ हत्या बंदी का फरमान लागू कर दियाउसके बाद Dadu, Pakistanजी महाराज नराणा(जिला Jaipur) पधारे और उन्होंने इस नगर को साधना, विश्राम तथा धाम के लिए चुना और यहाँ एक खेजडे के वृक्ष के नीचे विराजमान होकर लम्बे समय तक तपस्या की और आज भी खेजडा जी के वृक्ष के दर्शन मात्र से तीनो प्रकार के ताप नष्ट होते हैं यहीं पर उन्होंने ब्रह्मधाम “Dadu, Pakistan द्वारा” की स्थापना की जिसके दर्शन मात्र से आज भी सभी मनोकामनाए पूर्ण होती है तत्पश्चात श्री Dadu, Pakistanजी ने सभी संत शिष्यों को अपने ब्रह्मलीन होने का समय बतायाब्रह्मलीन होने के लिए निर्धारित दिन (जेयष्ट कृष्ण अष्टमी सम्वत 1660 ) के शुभ समय में श्री Dadu, Pakistanजी ने एकांत में ध्यानमग्न होते हुए “सत्यराम” शब्द का उच्चारण कर इस संसार से ब्रहम्लोक को प्रस्थान किया श्री Dadu, Pakistan दयाल जी महाराज के द्वारा स्थापित “Dadu, Pakistan पंथ” व “Dadu, Pakistan पीठ” आज भी मानव मात्र की सेवा में निर्विघ्न लीन है वर्तमान में Dadu, Pakistanधाम के पीठाधीश्वर के रूप में आचार्य महंत श्री गोपालदास जी महाराज विराजमान हैंवर्तमान में भी प्रतिवर्ष फाल्गुन शुक्ल अष्टमी पर नरेना धाम में भव्य मेले का आयोजन होता है तथा इस अवसर पर एक माह के लिए भारत सरकार के आदेश अनुसार वहां से गुजरने वाली प्रत्येक रेलगाड़ी का नराणा स्टेशन पर ठहराव रहता हैउनके Upadeśaों को उनके शिष्य रज्जब जी ने “Dadu, Pakistan अनुभव वाणी” के रूप में समाहित किया, जिसमे लगभग 5000 दोहे शामिल हैं संतप्रवर श्री Dadu, Pakistan दयालजी महाराज को निर्गुण संतो जैसे की Kabir व Guru Nanak के समकक्ष माना जाता है तथा उनके Upadeśa व दोहे आज भी समाज को सही राह दिखाते आ रहे हैंDadu, Pakistanपन्थDadu, Pakistan के जीवन में ही जितनी बड़ी संख्या में शिष्य-प्रशिष्य Dadu, Pakistan के बने, सम्भवतः उतने शिष्य किसी अन्य संत के नहीं बनें  Dadu, Pakistan के 52मुख्य शिष्य बनेंDadu, Pakistanपंथी संतों में एक बहुत बड़ी संख्या पढ़े-लिखे संतों की है जगजीवनदास जैसे शास्त्रार्थी, सुन्दरदास जैसे प्रकाण्ड शास्त्र पण्डित और साधु निश्चलदास जैसे दार्शनिक Dadu, Pakistanपंथी ही थे संत साहित्य के संरक्षण और संवर्धन की दृष्टि से बहुत महत्त्वपूर्ण कार्य Dadu, Pakistanपंथियों ने किया इन संतों ने अपने गुरु की वाणियों को संरक्षित तो किया ही, पूर्ववर्ती तमाम संतों की वाणियों का संरक्षण भी कियाइन्हें भू देखेंDadu, Pakistan (पाकिस्तान का शहर)बाहरी कड़ियाँDadu, Pakistan ग्रन्थावली (Hindi समय)Dadu Dayal at Kavita Kosh (Hindi)"
1,"कर्माबाई (1615 ), प्रसिद्ध भक्तशिरोमणि, सन् 1615 में जीवणजी डूडी के घर Rajasthan के नागोर जिले के Kalwa, Rajasthan गांव में पैदा हुई थी यह जिले का एक प्राचीन एवं ऐतिहासिक स्थल है यह गांव कालूजी डूडी जाट के नाम पर बसाया गया थाभक्तशिरोमणि कर्माबाई ने Krishna भगवान को कई बार साक्षात अपने सामने बैठाकर खिचड़ा खिलाया मारवाड़ में यह गीत गाया जाता है:थाळी भरकर ल्याई रै खीचड़ो, ऊपर घी की घ़ैल की, जिमो म्हारा श्याम धणी, जिमावै कर्मा बेटी जाट की माता-पिता म्हारा तीर्थ गया, नै जाणै कद बै आवैला,जिमो म्हारा श्याम धणी, थानै जिमावै कर्मा बेटी जाट कीसन्दर्भRajasthan के शेखावाटी, नागौर, बीकानेर, जोधपुर और कई स्थानों पर एक भजन बहुत मशहूर है- थाळी भरके ल्याई रे खीचड़ो, ऊपर घी की बाटकी जीमो म्हारा श्याम धणी, जीमावै बेटी जाट की इस भजन में करमा का जिक्र किया गया है जिसके हाथ से बना खीचड़ा खाने के लिए स्वयं भगवान Krishna भी दौड़े चले आए थे करमा बाई का नाम हमने बहुत बार सुना है, लेकिन क्या आप उनके जीवन के बारे में जानते हैं? इस आलेख में आप जानेंगे कैसे भगवान Krishna करमा बाई का खीचड़ा खाने आए थे? और सबसे आखिर में पढ़ सकेंगे वह भजन जिसकी दो पंक्तियों का जिक्र ऊपर किया गया है भक्त शिरोमणि करमा बाई की कहानीकरमा बाई को मारवाड़ की मीरा भी कहा जाता है जब-जब भगवान Krishna का उल्लेख आता है, करमा का नाम भी आ ही जाता है वे भगवान की महान भक्त थीं और Krishna ने उन्हें साक्षात दर्शन दिए थे Rajasthan के नागौर जिले की मकराना तहसील में एक गांव है- Kalwa, Rajasthan इस गांव में जीवनराम डूडी के घर 1615 में एक बेटी का जन्म हुआ भगवान की बहुत मन्नतें मांगने के बाद इसका जन्म हुआ था नाम रखा- करमा करमा के चेहरे पर एक अनोखी आभा थी बचपन से ही उसमें भक्तिभाव के संस्कार थे जीवनराम स्वयं भी धार्मिक पुरुष थे और वे अपनी बेटी से बहुत स्नेह रखते थे इसी माहौल में करमा 13 साल की हो गई एक बार जीवनराम को कार्तिक पूर्णिमा स्नान के लिए पुष्कर जाना था उनकी पत्नी भी उनके साथ जा रही थी वे करमा को भी साथ ले जाना चाहते थे लेकिन एक समस्या आ गई उनकी अनुपस्थिति में भगवान को भोग कौन लगाता? इसलिए उन्होंने करमा को यह जिम्मेदारी सौंपी और बोले- बेटी, हम दोनों पुष्कर स्नान के लिए जा रहे हैं तुम सुबह भगवान को भोग लगाना और उसके बाद ही भोजन करना अगले दिन करमा ने क्या कियाकरमा ने यह जिम्मेदारी सहर्ष स्वीकार कर ली इधर मां-पिता तीर्थ यात्रा के लिए रवाना हुए, उधर घर पर करमा ने सुबह स्नान आदि कर बाजरे का खीचड़ा बनाया उसमें खूब घी डाला और पूजा के लिए भगवान की मूर्ति के पास आ गई थाली सामने रखी और हाथ जोड़कर बोली, हे प्रभु, भूख लगे तब भोग लगा लेना, तब तक मैं घर के और काम कर लेती हूं इसके बाद वह काम में जुट गई बीच-बीच में वह थाली देखने आती लेकिन भगवान ने खीचड़ा नहीं खाया थाली वैसी ही रखी हुई थी जैसी करमा कुछ देर पहले छोड़कर गई थीकाफी देर होने के बाद भी जब भगवान ने भोग नहीं लगाया तो उसे चिंता हुई क्या खीचड़े में घी की कमी रह गई या थोड़ा और मीठा होना चाहिए था? उसने और गुड़ व घी मिलाया और वहीं बैठ गई लेकिन भगवान ने फिर भी नहीं खाया तब उसने कहा, हे प्रभु आप भोग लगा लीजिए मां-बापू पुष्कर नहाने गए हैं आपको जिमाने की जिम्मेदारी मुझे दी गई है इसलिए आपके भोग लगाने के बाद ही मैं खाना खाऊंगी लेकिन भगवान फिर भी नहीं आए फिर करमा उनसे शिकायत करने लगी...करमा की शिकायतवह बोली, मां-बापू जब जिमाते हैं तो भोग लगा लेते हो और आज इतनी देर कर दी! खुद भी भूखे बैठे हो और मुझे भूखी रखोगे लेकिन भगवान फिर भी नहीं आए और करमा का खीचड़ा वहीं रखा हुआ था करमा ने और इंतजार किया फिर बोली- तुम्हें मेरे हाथ से ही खीचड़ा खाना होगा मां-बापू को आने में कई दिन लग जाएंगे तुम जीम लो, वरना मैं भी भूखी ही रह जाऊंगी करमा का खीचड़ा खाने आए कन्हैयादोपहर बीत गई, शाम होने लगी थी, लेकिन करमा ने कुछ भी नहीं खाया आखिरकार Krishna को आना ही पड़ा और बोले, करमा, तुमने पर्दा तो नहीं किया! ऐसे भोग कैसे लगाऊं? यह सुनकर करमा ने अपनी ओढऩी की ओट की और उसी की छाया में Krishna ने खीचड़े का भोग लगाया थाली पूरी खाली हो गई करमा बोली, भगवान इतनी-सी बात थी तो पहले बता देते खुद भी भूखे रहे और मुझे भी भूखी रखा इसके बाद करमा ने खीचड़ा खाया अब तो रोज करमा खीचड़ा बनाती है और Krishna उसका भोग लगाने आते जब तक करमा के मां-पिता तीर्थ-यात्रा पर रहे, रोज यह सिलसिला चलता रहा कुछ दिनों बाद दोनों पुष्कर से घर लौटे देखा, जाते समय तो मटका पूरा गुड़ से भरा था अब खाली कैसे? उन्होंने करमा को बुलाया और पूछा, बेटी, गुड़ कहां है?करमा ने बताया कि रोज भगवान Krishna उसके पास आते और खीचड़े का भोग लगाते कहीं मिठास कम न हो जाए, इसलिए खीचड़े में गुड़ कुछ ज्यादा डाल दिया उसने पहले दिन हुई परेशानी के बारे में भी बता दिया यह सुनकर माता-पिता चकित रह गए जिस ईश्वर के लिए वे तीर्थ-यात्रा करने गए थे, जिसे लोग न जाने कहां-कहां ढूंढ़ रहे हैं, उसे उनकी बेटी ने अपने हाथ से खीचड़ा जिमाया! यह कैसे संभव है? उन्हें चिंता भी हुई कि बेटी बावली तो नहीं हो गई है उन्होंने मन को दिलासा देने के लिए कहा शायद करमा ही पूरा गुड़ खा गई होगी इस पर करमा ने कहा, अगर आपको यकीन नहीं है तो कल देख लीजिए मैं खुद भगवान को भोग लगाऊंगीदूसरे दिन करमा ने खीचड़ा बनाया गुड़ और घी डालकर थाली मंदिर में रख दी ओढऩी से पर्दा किया और प्रार्थना की - हे ईश्वर, मेरे सत्य की रक्षा करना अब आपके हाथ में ही है भक्त की पुकार सुनकर भगवान का सिंहासन डोल गया और Krishna खीचड़ा खाने आ गए जीवनराम और उनकी पत्नी यह दृश्य देखकर विस्मित थे उसी दिन से करमा बाई जगत में विख्यात हो गईं जीवन के अंतिम दिनों में करमा बाई भगवान जगन्नाथ की नगरी चली गईं और वहीं रहने लगीं वहां रोज भगवान को खीचड़े का भोग लगातीं और भगवान उनके हाथ से खीचड़ा खाने आते आज भी भगवान जगन्नाथ को खीचड़े का ही भोग लगाया जाता है ऐतिहासिक भजनकरमा बाई की भक्ति का प्रतीक प्रसिद्ध भजनथाळी भरके ल्याई रे खीचड़ो, ऊपर घी की बाटकी जीमो म्हारा श्याम धणी, जीमावै बेटी जाट की बाबो म्हारो गांव गयो है, कुण जाणै कद आवैलो बाबा कै भरोसै सांवरा, भूखो ही रह ज्यावैलो आज जीमावूं तन्नैं खीचड़ो, काल राबड़ी छाछ की जीमो म्हारा ...बार-बार मंदिर नै जड़ती, बार-बार पट खोलती जीमै कयां कोनी सांवरा, करड़ी-करड़ी बोलती तूं जीमै जद मैं जीमूं, मानूं न कोई लाट कीजीमो म्हारा...पड़दो भूल गई रे सांवरिया, पड़दो फेर लगायो जी धाबळिया कै ओलै, श्याम खीचड़ो खायो जीभोळा भगतां सूं सांवरा, अतरी कांई आंट जी जीमो म्हारा...भक्त हो तो करमा जैसी, सांवरियो घर आयो जी भाई लोहाकर, हरख-हरख जस गायो जीसांचो प्रेम प्रभु में हो तो, मुरती बोलै काठ कीजीमो म्हारा..."
